,number,value,datetime_start,datetime_complete,duration,params_activation_fn,params_ent_coef,params_gae_lambda,params_gamma,params_learning_rate,params_lr_schedule,params_max_grad_norm,params_n_steps,params_net_arch,params_normalize_advantage,params_ortho_init,params_use_rms_prop,params_vf_coef,state
197,197,0.34199999999999997,2024-05-19 05:37:04.455403,2024-05-19 06:08:11.635064,0 days 00:31:07.179661,tanh,1.4125016819074665e-06,0.92,0.995,0.0003667082877381052,linear,2.0,64,medium,True,True,True,0.8975808597650483,PRUNED
198,198,0.9800000000000001,2024-05-19 05:40:23.117560,2024-05-19 05:55:59.673738,0 days 00:15:36.556178,tanh,1.2592391012097052e-05,0.95,0.995,0.00017210547184840535,linear,2.0,64,medium,True,True,True,0.9470519463256267,COMPLETE
199,199,0.9400000000000001,2024-05-19 05:43:57.872307,2024-05-19 06:00:12.147981,0 days 00:16:14.275674,tanh,0.00010723649190222978,0.92,0.995,7.14970102804993e-05,linear,0.8,512,medium,True,True,True,0.7862777420753502,COMPLETE
200,200,0.066,2024-05-19 05:44:16.329252,2024-05-19 06:22:42.305882,0 days 00:38:25.976630,tanh,5.7065677969292804e-05,0.95,0.995,0.0024321242003786862,linear,2.0,64,small,True,True,True,0.9265473094085783,PRUNED
201,201,0.366,2024-05-19 05:45:19.083945,2024-05-19 06:16:30.888596,0 days 00:31:11.804651,tanh,0.0005019363368757629,0.95,0.999,7.667735780388965e-05,constant,0.5,32,medium,True,True,True,0.9171806250627795,PRUNED
202,202,0.044,2024-05-19 05:45:34.424216,2024-05-19 06:24:36.971009,0 days 00:39:02.546793,tanh,4.038228196352766e-05,0.95,0.95,0.0002345432066105113,linear,2.0,32,medium,True,True,True,0.6319623413914183,PRUNED
203,203,0.356,2024-05-19 05:51:58.314259,2024-05-19 06:23:16.060600,0 days 00:31:17.746341,tanh,4.765773573783561e-07,0.95,0.995,0.0016011755436280627,linear,2.0,256,medium,True,True,True,0.91546292760046,PRUNED
204,204,0.9400000000000001,2024-05-19 05:52:09.843721,2024-05-19 06:08:19.492942,0 days 00:16:09.649221,tanh,7.162238877249518e-07,0.92,0.995,0.00013836332268992772,linear,2.0,64,medium,True,True,True,0.7456106373538921,COMPLETE
205,205,0.0,2024-05-19 05:55:59.674737,2024-05-19 06:33:18.957537,0 days 00:37:19.282800,tanh,3.002814919256445e-05,0.95,0.999,0.0015641337718597967,constant,0.5,32,medium,True,False,True,0.6592496037633203,PRUNED
206,206,1.292,2024-05-19 06:00:12.150982,2024-05-19 06:09:01.778948,0 days 00:08:49.627966,tanh,0.00032743877152737377,0.92,0.995,0.0001549170790600087,linear,0.3,512,medium,True,True,True,0.7161305132486506,COMPLETE
207,207,-5199.294,2024-05-19 06:01:02.582454,2024-05-19 06:40:07.940171,0 days 00:39:05.357717,tanh,0.00014574853593663206,0.92,0.995,0.0005939540788732533,linear,0.8,1024,medium,True,True,True,0.657980997555071,PRUNED
208,208,0.0,2024-05-19 06:02:21.850112,2024-05-19 06:41:09.149361,0 days 00:38:47.299249,tanh,0.00010901808908980527,0.92,0.995,0.0013257905893354763,linear,0.8,512,medium,True,False,True,0.8800971723741499,PRUNED
209,209,0.9360000000000002,2024-05-19 06:02:35.588793,2024-05-19 06:18:55.988068,0 days 00:16:20.399275,tanh,1.9394886142443303e-05,0.92,0.995,0.00027217620013452246,linear,0.8,512,medium,True,True,True,0.45435870073257584,COMPLETE
210,210,0.676,2024-05-19 06:02:40.988718,2024-05-19 06:26:34.233203,0 days 00:23:53.244485,tanh,0.00015240732986740384,0.8,0.995,4.789241820770104e-05,linear,0.8,512,medium,True,True,True,0.8241627848854624,COMPLETE
211,211,0.35,2024-05-19 06:02:46.664816,2024-05-19 06:34:10.109555,0 days 00:31:23.444739,tanh,1.3753883279582746e-05,0.92,0.995,0.0019172598596930274,constant,2.0,1024,medium,True,True,True,0.9618319729927681,PRUNED
212,212,0.366,2024-05-19 06:03:29.282006,2024-05-19 06:34:44.243132,0 days 00:31:14.961126,tanh,7.775621242095975e-06,0.92,0.995,0.0011211641075623664,linear,0.6,512,medium,True,True,True,0.7439240764162007,PRUNED
213,213,0.6759999999999999,2024-05-19 06:08:11.636066,2024-05-19 06:31:58.028457,0 days 00:23:46.392391,tanh,0.0012454469962839855,0.92,0.995,0.0005092571585459996,linear,0.8,128,medium,True,True,True,0.9923532759962645,COMPLETE
214,214,-0.003999999999999999,2024-05-19 06:08:19.493940,2024-05-19 06:47:05.098092,0 days 00:38:45.604152,tanh,9.367473027995549e-07,0.95,0.9999,0.00015431965673309007,linear,0.9,32,medium,True,True,True,0.8863727946748564,PRUNED
215,215,0.6699999999999999,2024-05-19 06:09:01.781946,2024-05-19 06:32:48.459152,0 days 00:23:46.677206,tanh,0.004338479570095268,0.92,0.995,0.0001726433153921643,linear,0.3,512,medium,True,True,True,0.8167905267369525,COMPLETE
216,216,0.382,2024-05-19 06:11:35.280024,2024-05-19 06:42:59.733779,0 days 00:31:24.453755,tanh,4.869779624341779e-05,0.92,0.995,7.295643648284603e-05,linear,0.8,512,medium,True,True,True,0.6495993921316161,COMPLETE
217,217,0.0,2024-05-19 06:15:16.528070,2024-05-19 06:54:03.992133,0 days 00:38:47.464063,relu,3.2731194169001145e-07,0.92,0.9999,0.05548293702451049,constant,2.0,128,medium,True,True,False,0.019950858430581083,PRUNED
218,218,0.942,2024-05-19 06:16:30.889595,2024-05-19 06:32:54.155656,0 days 00:16:23.266061,tanh,6.90556152252307e-05,1.0,0.95,0.0031669675327651017,linear,0.3,512,medium,True,True,True,0.5197457700565903,COMPLETE
219,219,-199.014,2024-05-19 06:18:55.990070,2024-05-19 06:35:11.412567,0 days 00:16:15.422497,tanh,0.0003035446054238173,1.0,0.9999,3.0964866122348704e-05,linear,0.8,512,medium,True,True,True,0.6997066169839625,PRUNED
220,220,0.0,2024-05-19 06:22:42.306885,2024-05-19 07:01:33.203652,0 days 00:38:50.896767,relu,1.4314999963738275e-05,0.92,0.995,9.261578529323367e-05,linear,0.9,512,medium,True,True,True,0.5660014767146081,PRUNED
221,221,0.6699999999999999,2024-05-19 06:23:16.061596,2024-05-19 06:47:14.981917,0 days 00:23:58.920321,tanh,0.000690187439564658,0.92,0.995,2.291798996223499e-05,linear,0.8,512,medium,True,True,True,0.6969158336054173,COMPLETE
222,222,0.874,2024-05-19 06:24:36.972011,2024-05-19 06:41:05.171765,0 days 00:16:28.199754,tanh,3.5580174888072545e-05,0.92,0.995,0.0020321007267838287,linear,0.8,512,medium,True,True,True,0.4253262245399784,COMPLETE
223,223,0.052000000000000005,2024-05-19 06:26:34.235203,2024-05-19 07:05:39.290892,0 days 00:39:05.055689,tanh,0.00104386377770333,0.92,0.995,0.00016235748469328227,linear,0.8,8,medium,True,True,True,0.44939522955770955,PRUNED
224,224,0.358,2024-05-19 06:31:58.029458,2024-05-19 07:03:26.823733,0 days 00:31:28.794275,tanh,6.260494198308057e-05,0.92,0.995,1.3251430333505163e-05,linear,0.5,512,medium,True,True,True,0.6936981645248489,PRUNED
225,225,0.674,2024-05-19 06:32:48.460150,2024-05-19 06:56:44.006688,0 days 00:23:55.546538,tanh,2.7908479477912938e-05,0.92,0.995,0.0005354987051576624,linear,0.8,512,medium,True,True,True,0.3612900062265957,COMPLETE
226,226,-99.99,2024-05-19 06:32:54.157662,2024-05-19 07:11:48.045891,0 days 00:38:53.888229,tanh,1.0837366200856261e-05,1.0,0.95,0.21480498772308154,linear,0.3,512,medium,True,True,True,0.6926703065405407,PRUNED
227,227,0.0,2024-05-19 06:33:18.958536,2024-05-19 07:10:45.781774,0 days 00:37:26.823238,tanh,1.2385244813541258e-05,0.92,0.995,0.004060119563210889,linear,0.6,512,medium,True,False,True,0.5084656733689559,PRUNED
228,228,0.9860000000000001,2024-05-19 06:34:10.111554,2024-05-19 06:50:50.036005,0 days 00:16:39.924451,tanh,1.7415021274405257e-06,0.92,0.995,0.0004901344385716292,linear,0.8,8,medium,True,True,True,0.4770618425125089,COMPLETE
229,229,-499.954,2024-05-19 06:34:44.244137,2024-05-19 07:13:38.215251,0 days 00:38:53.971114,tanh,5.637175749812996e-06,1.0,0.95,0.15552370815987426,linear,0.3,512,medium,True,True,True,0.48197735294380606,PRUNED
230,230,0.982,2024-05-19 06:35:11.414565,2024-05-19 06:51:43.405728,0 days 00:16:31.991163,tanh,7.131634521354066e-06,0.92,0.995,0.0003173196412242584,linear,0.8,512,medium,True,True,True,0.3309046501136358,COMPLETE
231,231,-399.918,2024-05-19 06:40:07.942175,2024-05-19 07:19:10.047006,0 days 00:39:02.104831,tanh,0.00011875379705207207,1.0,0.95,0.05706532580224834,linear,0.3,512,medium,True,True,False,0.6635204194017346,PRUNED
232,232,-499.946,2024-05-19 06:41:05.175272,2024-05-19 07:20:19.535242,0 days 00:39:14.359970,tanh,2.296512586690565e-05,0.98,0.9999,0.013929148448603162,linear,2.0,16,medium,True,True,True,0.7828020521934773,PRUNED
233,233,0.038,2024-05-19 06:41:09.151362,2024-05-19 07:20:09.911451,0 days 00:39:00.760089,tanh,3.83302061826439e-05,1.0,0.95,0.004588042635053219,linear,0.3,512,medium,True,True,True,0.6293017886433343,PRUNED
234,234,0.022000000000000002,2024-05-19 06:42:59.736777,2024-05-19 07:21:36.812820,0 days 00:38:37.076043,tanh,0.0007349035313282753,1.0,0.95,0.001999005701920961,linear,0.7,512,medium,True,True,True,0.5445974987294238,PRUNED
235,235,-2549.5119999999997,2024-05-19 06:47:05.100088,2024-05-19 07:18:20.834369,0 days 00:31:15.734281,tanh,4.578332044056819e-06,1.0,0.995,0.0003752536145950762,linear,0.3,1024,medium,True,True,True,0.43860686582610736,PRUNED
236,236,0.0,2024-05-19 06:47:14.982919,2024-05-19 07:25:07.173710,0 days 00:37:52.190791,relu,0.0016365402235858086,1.0,0.95,0.0006883802126461742,linear,0.3,512,medium,True,True,True,0.6305109297673772,PRUNED
237,237,-499.938,2024-05-19 06:50:50.038002,2024-05-19 07:27:30.148495,0 days 00:36:40.110493,tanh,7.048917782107909e-06,1.0,0.95,0.13395005339551436,linear,0.3,512,small,True,True,True,0.5500468130735915,PRUNED
238,238,-199.844,2024-05-19 06:51:43.407729,2024-05-19 07:28:08.268613,0 days 00:36:24.860884,tanh,0.0022411253368048185,0.95,0.9999,0.0005438108329516044,linear,0.9,64,medium,True,True,False,0.8560368146437892,PRUNED
239,239,0.374,2024-05-19 06:54:03.993132,2024-05-19 07:24:40.365992,0 days 00:30:36.372860,tanh,5.5816894910700026e-06,0.92,0.995,0.000829598732615492,linear,0.5,512,medium,True,True,True,0.3392348035007557,COMPLETE
240,240,0.352,2024-05-19 06:56:44.008687,2024-05-19 07:26:31.149868,0 days 00:29:47.141181,tanh,5.663555810653579e-08,0.92,0.995,0.00018913305566294929,linear,2.0,16,medium,True,True,True,0.40532920751560275,PRUNED
241,241,-499.95,2024-05-19 07:01:33.205651,2024-05-19 07:32:41.573780,0 days 00:31:08.368129,tanh,0.00011950309917188999,1.0,0.95,0.04123231048067352,linear,0.3,512,medium,True,True,True,0.5069440792021606,PRUNED
242,242,-499.946,2024-05-19 07:03:26.824735,2024-05-19 07:33:24.066668,0 days 00:29:57.241933,tanh,2.581931664401776e-07,0.92,0.99,0.014894254046635275,linear,0.8,8,medium,True,True,True,0.5030795499745553,PRUNED
243,243,0.038,2024-05-19 07:05:39.293891,2024-05-19 07:34:02.767968,0 days 00:28:23.474077,tanh,1.9935410652458105e-08,0.92,0.995,5.970349554053556e-05,linear,0.8,8,medium,True,True,True,0.5224240109133409,PRUNED
244,244,1.29,2024-05-19 07:10:45.782776,2024-05-19 07:19:30.074778,0 days 00:08:44.292002,relu,8.331283074355022e-07,0.92,0.995,0.0006768088409534639,linear,0.8,8,medium,True,True,True,0.610443044532582,COMPLETE
245,245,-299.66999999999996,2024-05-19 07:11:48.046894,2024-05-19 07:33:31.536294,0 days 00:21:43.489400,tanh,8.43371274244518e-06,1.0,0.9,0.0018228772012753598,linear,0.3,512,medium,True,True,True,0.5028084390149516,PRUNED
246,246,0.9860000000000001,2024-05-19 07:13:38.217253,2024-05-19 07:27:43.781036,0 days 00:14:05.563783,tanh,3.15671334354687e-05,1.0,0.995,0.00032820528365125985,linear,0.8,16,medium,False,True,True,0.280086345643581,COMPLETE
247,247,0.358,2024-05-19 07:18:20.835369,2024-05-19 07:35:05.345197,0 days 00:16:44.509828,tanh,1.1844023717437718e-05,0.99,0.95,0.0004944180224385868,linear,0.3,512,medium,True,True,True,0.28793117644042965,PRUNED
248,248,-99.61,2024-05-19 07:19:10.048008,2024-05-19 07:35:13.123821,0 days 00:16:03.075813,tanh,5.870355838446545e-05,0.9,0.95,0.000739802948349562,linear,0.3,512,medium,True,True,True,0.39064249831702935,PRUNED
249,249,0.0,2024-05-19 07:19:30.076779,2024-05-19 07:35:39.226197,0 days 00:16:09.149418,tanh,0.0008145447834016366,0.8,0.9999,0.0011110225369931727,constant,0.5,32,small,True,True,True,0.7665990482981065,PRUNED
